{
  "version": "3.0.0",
  "requirement_id_prefix": "ARB",
  "id_aliases": {
    "REQ-001": "ARB-001",
    "REQ-002": "ARB-002",
    "REQ-003": "ARB-003",
    "REQ-004": "ARB-004",
    "REQ-005": "ARB-005",
    "REQ-006": "ARB-006",
    "REQ-007": "ARB-007",
    "REQ-008": "ARB-008",
    "REQ-009": "ARB-009",
    "REQ-010": "ARB-010",
    "REQ-011": "ARB-011",
    "REQ-012": "ARB-012",
    "REQ-013": "ARB-013",
    "REQ-014": "ARB-014",
    "REQ-015": "ARB-015",
    "REQ-016": "ARB-016",
    "REQ-017": "ARB-017",
    "REQ-018": "ARB-018",
    "REQ-019": "ARB-019",
    "REQ-020": "ARB-020",
    "REQ-021": "ARB-021",
    "REQ-022": "ARB-022",
    "REQ-023": "ARB-023",
    "REQ-024": "ARB-024",
    "REQ-025": "ARB-025",
    "REQ-026": "ARB-026",
    "REQ-027": "ARB-027",
    "REQ-028": "ARB-028",
    "REQ-029": "ARB-029",
    "REQ-030": "ARB-030",
    "REQ-031": "ARB-031",
    "REQ-032": "ARB-032",
    "REQ-033": "ARB-033",
    "REQ-034": "ARB-034",
    "REQ-035": "ARB-035",
    "REQ-036": "ARB-036",
    "REQ-037": "ARB-037",
    "REQ-038": "ARB-038",
    "REQ-039": "ARB-039",
    "REQ-040": "ARB-040",
    "REQ-041": "ARB-041",
    "REQ-042": "ARB-042",
    "REQ-043": "ARB-043",
    "REQ-044": "ARB-044"
  },
  "requirements": [
    {
      "id": "ARB-005",
      "category": "legal",
      "title": "Establish licensing terms for arbiter",
      "description": "Partly closed by engineering as of 2026-09-14; the remainder needs counsel and cannot be completed here. LICENSE exists at the repository root and pyproject.toml references it, copyright is asserted to Nicholas J Pauken, and LICENSE section 3 assigns scan output to the user -- the first three acceptance criteria. LICENSE is explicitly an interim notice and not the operative grant: it reserves all rights and grants none. The fourth criterion is L-6, the redistribution review for the five bundled analyzers, recorded in NOTICE.md with a date and a named reviewer. That is a legal determination about semgrep's LGPL-2.1 terms and it must not be signed by anyone who did not perform it, so this requirement stays pending until a person does. It blocks the air-gapped bundle and nothing else; docs/licensing.md records the open questions.",
      "priority": "high",
      "status": "pending",
      "minimum_access_scope": [
        "docs/licensing.md",
        "NOTICE.md",
        "LICENSE",
        "pyproject.toml",
        "README.md"
      ],
      "acceptance_criteria": [
        "a LICENSE file exists at the repository root and pyproject.toml references it",
        "copyright ownership is asserted",
        "ownership of scan output is assigned to the user",
        "the redistribution review for bundled analyzers is recorded in NOTICE.md with a date and a reviewer"
      ],
      "validation_required": [
        "python omni doctor"
      ],
      "documentation_required": [
        "docs/licensing.md",
        "NOTICE.md",
        "README.md"
      ],
      "risk_notes": [
        "Requires qualified legal review and cannot be completed by engineering alone",
        "the air-gapped bundle roadmap item stays blocked until the semgrep LGPL-2.1 redistribution question is answered",
        "2026-10-09: the air-gapped bundle now ships without the analyzers (ARB-051); only including them in the bundle stays blocked on the L-6 redistribution review."
      ]
    },
    {
      "id": "ARB-020",
      "category": "developer-tooling",
      "title": "Attribute every adjudication verdict to a reviewer and a time",
      "description": "learn.record() stores a verdict as the bare string 'true_positive' or 'false_positive:note' in Knowledge.adjudicated, with no reviewer, no per-verdict timestamp and no record of which entry point it arrived through. Only the rule carries first_seen/last_seen. The ledger refuses re-adjudication, so a wrong or machine-written mark is permanent and, today, untraceable: there is no way to find whose marks to distrust. The rule that verdicts come from a person is enforced in assistant instructions, not in the code. This matters more now that agents hold shell access and more again if a second person ever adjudicates.",
      "priority": "high",
      "status": "completed",
      "minimum_access_scope": [
        "src/arbiter/learn.py",
        "src/arbiter/cli.py",
        "tests/test_arbiter.py",
        "docs/calibration.md"
      ],
      "acceptance_criteria": [
        "Knowledge.adjudicated holds a structured record carrying verdict reviewer timestamp and entry point rather than a bare string/KNOWLEDGE_VERSION is raised and from_dict migrates a version 1 ledger without losing any existing verdict/record() requires a reviewer identity and refuses to write without one/the reviewer is resolved from an explicit flag or git config user rather than defaulted silently/a test asserts a version 1 ledger round-trips through the new schema/a test asserts a verdict without a reviewer is refused"
      ],
      "validation_required": [
        "PYTHONPATH=src python -m pytest -q"
      ],
      "documentation_required": [
        "docs/calibration.md",
        "CHANGELOG.md",
        ".ai/project-context.md"
      ],
      "risk_notes": [
        "The ledger is committed and feeds version_hash() so the schema change moves the knowledge version and any pinned scan must be re-pinned/The live ledger has zero adjudications so migration is untested against real data and should be tested against a synthetic version 1 file/Attribution records who not whether they were human and must not be described as proof of personhood"
      ]
    },
    {
      "id": "ARB-021",
      "category": "developer-tooling",
      "title": "Refuse an adjudication verdict from a non-interactive session",
      "description": "Nothing distinguishes a verdict typed by a person from one written by a script or an agent. review_ui._getch() falls back to input() when raw terminal mode is unavailable, nothing calls isatty(), and cli.cmd_feedback records a verdict from a fully non-interactive invocation. review --apply reads marks from a markdown file, so anything that can write markdown can adjudicate. This is no barrier against a determined caller and is not claimed to be one; it stops the accidental case, which is a piped script, a CI job or an agent shelling out.",
      "priority": "high",
      "status": "completed",
      "minimum_access_scope": [
        "src/arbiter/cli.py",
        "src/arbiter/review_ui.py",
        "tests/test_arbiter.py",
        "docs/calibration.md"
      ],
      "acceptance_criteria": [
        "the interactive adjudication paths require stdin to be a terminal and refuse otherwise with a reason/the refusal names an explicit override flag so a deliberate batch import is possible and visible/an overridden verdict is recorded with an entry point that says it was not interactive/docs/calibration.md states plainly that this is a guard against accident and not proof of personhood/a test asserts a piped non-interactive feedback invocation is refused"
      ],
      "validation_required": [
        "PYTHONPATH=src python -m pytest -q"
      ],
      "documentation_required": [
        "docs/calibration.md",
        "CHANGELOG.md",
        ".ai/project-context.md"
      ],
      "risk_notes": [
        "Depends on ARB-020 for the entry point field so it should land after it/An override flag that is easy to pass is an override an agent can pass so the value is the record it leaves not the obstacle it creates/Existing tests that record verdicts programmatically will need the override or a direct call to record()"
      ]
    },
    {
      "id": "ARB-022",
      "category": "developer-tooling",
      "title": "Declare adapter probe scope deliberately and say what a partial scan does not run",
      "description": "adapters.register_adapters constructs every adapter-backed Probe without a scope argument, so all five external analyzers inherit the repo default from Probe and are recorded as not-assessed in any partial scan. The default is right because nothing has established that ruff bandit checkov semgrep or gitleaks give subset-exact answers on a file subset, but it is inherited rather than chosen. docs/ci.md explains file and repo scope carefully and never names the external analyzers; RUNNING-ON-YOUR-OWN-CODE.md describes the pull-request job without saying it runs native probes only. A reader of either document would reasonably believe their gate runs semgrep. It does not.",
      "priority": "high",
      "status": "completed",
      "minimum_access_scope": [
        "src/arbiter/adapters.py",
        "src/arbiter/packs/",
        "docs/ci.md",
        "RUNNING-ON-YOUR-OWN-CODE.md",
        "tests/test_arbiter.py"
      ],
      "acceptance_criteria": [
        "every adapter manifest declares its scope explicitly/register_adapters passes the declared scope instead of relying on the Probe default/docs/ci.md names the five external analyzers as repo-scoped and says a partial scan does not run them/RUNNING-ON-YOUR-OWN-CODE.md says the same where it describes the pull-request job/a test asserts no adapter-backed probe relies on the inherited default"
      ],
      "validation_required": [
        "PYTHONPATH=src python -m pytest -q"
      ],
      "documentation_required": [
        "docs/ci.md",
        "RUNNING-ON-YOUR-OWN-CODE.md",
        "CHANGELOG.md",
        ".ai/project-context.md"
      ],
      "risk_notes": [
        "Declaring any adapter file-scoped would assert subset-exactness that has never been measured so every declaration must stay repo until evidence exists/This is a documentation and deliberateness change and must not be described as making partial scans cover more"
      ]
    },
    {
      "id": "ARB-023",
      "category": "training-evidence",
      "title": "Cover the nightly training job with a requirement and a test",